{
  "$schema": "../schema/catalog.schema.json",
  "format": "design3d.catalog",
  "version": "0.1.0",
  "items": [
    {
      "id": "sofa/modern-l",
      "name": {
        "pt-BR": "Sofá em L moderno",
        "en": "Modern L sofa"
      },
      "category": "sofa",
      "model": "procedural/sofa-l",
      "dimensions": {
        "width": 2.6,
        "height": 0.85,
        "depth": 1.6
      },
      "resizable": {
        "width": [
          1.8,
          3.6
        ],
        "depth": [
          1.2,
          2
        ],
        "height": [
          0.7,
          1
        ]
      },
      "materialSlots": {
        "upholstery": {
          "label": "Estofado",
          "default": "fabric/navy-velvet",
          "allowed": [
            "fabric",
            "leather"
          ]
        },
        "cushions": {
          "label": "Almofadas",
          "default": "fabric/rust-wool",
          "allowed": [
            "fabric",
            "leather"
          ]
        },
        "legs": {
          "label": "Pés",
          "default": "wood/walnut",
          "allowed": [
            "wood",
            "metal",
            "stone",
            "paint",
            "plastic"
          ]
        }
      },
      "tags": [
        "sala",
        "estar"
      ],
      "license": "Próprio (gerado por código neste repositório)",
      "thumbnail": "thumbnails/sofa-modern-l.png"
    },
    {
      "id": "sofa/modern-3-seat",
      "name": {
        "pt-BR": "Sofá de 3 lugares",
        "en": "Modern 3-seat sofa"
      },
      "category": "sofa",
      "model": "models/sofa-3.glb",
      "dimensions": {
        "width": 2.2,
        "height": 0.85,
        "depth": 0.95
      },
      "resizable": {
        "width": [
          1.6,
          3
        ],
        "depth": [
          0.8,
          1.1
        ],
        "height": [
          0.7,
          1
        ]
      },
      "materialSlots": {
        "upholstery": {
          "label": "Estofado",
          "default": "fabric/grey-wool",
          "allowed": [
            "fabric",
            "leather"
          ]
        },
        "cushions": {
          "label": "Almofadas",
          "default": "fabric/ochre-velvet",
          "allowed": [
            "fabric",
            "leather"
          ]
        },
        "legs": {
          "label": "Pés",
          "default": "wood/walnut",
          "allowed": [
            "wood",
            "metal",
            "stone",
            "paint",
            "plastic"
          ]
        }
      },
      "tags": [
        "sala",
        "estar"
      ],
      "license": "Próprio (gerado por código neste repositório)",
      "thumbnail": "thumbnails/sofa-modern-3-seat.png"
    },
    {
      "id": "chair/armchair-lounge",
      "name": {
        "pt-BR": "Poltrona lounge",
        "en": "Lounge armchair"
      },
      "category": "chair",
      "model": "models/armchair.glb",
      "dimensions": {
        "width": 0.85,
        "height": 0.85,
        "depth": 0.85
      },
      "resizable": {
        "width": [
          0.65,
          1.1
        ],
        "depth": [
          0.65,
          1.1
        ],
        "height": [
          0.7,
          1
        ]
      },
      "materialSlots": {
        "upholstery": {
          "label": "Estofado",
          "default": "leather/cognac",
          "allowed": [
            "fabric",
            "leather"
          ]
        },
        "frame": {
          "label": "Estrutura",
          "default": "wood/walnut",
          "allowed": [
            "wood",
            "metal",
            "stone",
            "paint",
            "plastic"
          ]
        }
      },
      "tags": [
        "sala",
        "leitura"
      ],
      "license": "Próprio (gerado por código neste repositório)",
      "thumbnail": "thumbnails/chair-armchair-lounge.png"
    },
    {
      "id": "table/dining-rect",
      "name": {
        "pt-BR": "Mesa de jantar retangular",
        "en": "Rectangular dining table"
      },
      "category": "table",
      "model": "procedural/table-dining",
      "dimensions": {
        "width": 1.6,
        "height": 0.75,
        "depth": 0.9
      },
      "resizable": {
        "width": [
          1,
          3
        ],
        "depth": [
          0.7,
          1.2
        ]
      },
      "materialSlots": {
        "top": {
          "label": "Tampo",
          "default": "wood/walnut",
          "allowed": [
            "wood",
            "stone",
            "ceramic",
            "paint"
          ]
        },
        "legs": {
          "label": "Pés",
          "default": "wood/walnut",
          "allowed": [
            "wood",
            "metal",
            "stone",
            "paint",
            "plastic"
          ]
        }
      },
      "tags": [
        "jantar"
      ],
      "license": "Próprio (gerado por código neste repositório)",
      "thumbnail": "thumbnails/table-dining-rect.png"
    },
    {
      "id": "table/coffee-round",
      "name": {
        "pt-BR": "Mesa de centro redonda",
        "en": "Round coffee table"
      },
      "category": "table",
      "model": "procedural/table-coffee-round",
      "dimensions": {
        "width": 0.8,
        "height": 0.4,
        "depth": 0.8
      },
      "resizable": {
        "width": [
          0.5,
          1.2
        ],
        "depth": [
          0.5,
          1.2
        ],
        "height": [
          0.3,
          0.5
        ]
      },
      "materialSlots": {
        "top": {
          "label": "Tampo",
          "default": "wood/walnut",
          "allowed": [
            "wood",
            "stone",
            "ceramic",
            "paint"
          ]
        }
      },
      "tags": [
        "sala"
      ],
      "license": "Próprio (gerado por código neste repositório)",
      "thumbnail": "thumbnails/table-coffee-round.png"
    },
    {
      "id": "chair/dining-wood",
      "name": {
        "pt-BR": "Cadeira de jantar de madeira",
        "en": "Wooden dining chair"
      },
      "category": "chair",
      "model": "models/chair-dining.glb",
      "dimensions": {
        "width": 0.46,
        "height": 0.86,
        "depth": 0.5
      },
      "materialSlots": {
        "frame": {
          "label": "Estrutura",
          "default": "wood/walnut",
          "allowed": [
            "wood",
            "metal",
            "stone",
            "paint",
            "plastic"
          ]
        },
        "seat": {
          "label": "Assento",
          "default": "fabric/rust-wool",
          "allowed": [
            "fabric",
            "leather",
            "wood"
          ]
        }
      },
      "tags": [
        "jantar"
      ],
      "license": "Próprio (gerado por código neste repositório)",
      "thumbnail": "thumbnails/chair-dining-wood.png"
    },
    {
      "id": "chair/office",
      "name": {
        "pt-BR": "Cadeira de escritório",
        "en": "Office chair"
      },
      "category": "chair",
      "model": "procedural/chair-office",
      "dimensions": {
        "width": 0.6,
        "height": 0.95,
        "depth": 0.6
      },
      "materialSlots": {
        "seat": {
          "label": "Estofado",
          "default": "fabric/charcoal-felt",
          "allowed": [
            "fabric",
            "leather"
          ]
        },
        "frame": {
          "label": "Estrutura",
          "default": "metal/black-matte",
          "allowed": [
            "wood",
            "metal",
            "stone",
            "paint",
            "plastic"
          ]
        }
      },
      "tags": [
        "escritório"
      ],
      "license": "Próprio (gerado por código neste repositório)",
      "thumbnail": "thumbnails/chair-office.png"
    },
    {
      "id": "desk/simple",
      "name": {
        "pt-BR": "Escrivaninha simples",
        "en": "Simple desk"
      },
      "category": "desk",
      "model": "procedural/desk",
      "dimensions": {
        "width": 1.2,
        "height": 0.75,
        "depth": 0.6
      },
      "resizable": {
        "width": [
          0.8,
          2
        ],
        "depth": [
          0.5,
          0.9
        ]
      },
      "materialSlots": {
        "top": {
          "label": "Tampo",
          "default": "wood/natural-oak",
          "allowed": [
            "wood",
            "stone",
            "paint"
          ]
        },
        "legs": {
          "label": "Pés",
          "default": "metal/black-matte",
          "allowed": [
            "wood",
            "metal",
            "stone",
            "paint",
            "plastic"
          ]
        }
      },
      "tags": [
        "escritório"
      ],
      "license": "Próprio (gerado por código neste repositório)",
      "thumbnail": "thumbnails/desk-simple.png"
    },
    {
      "id": "bed/queen-modern",
      "name": {
        "pt-BR": "Cama de casal moderna",
        "en": "Modern queen bed"
      },
      "category": "bed",
      "model": "models/bed-queen.glb",
      "dimensions": {
        "width": 1.6,
        "height": 1,
        "depth": 2.1
      },
      "resizable": {
        "width": [
          0.9,
          2.1
        ],
        "depth": [
          1.9,
          2.2
        ]
      },
      "materialSlots": {
        "bedding": {
          "label": "Roupa de cama",
          "default": "fabric/linen",
          "allowed": [
            "fabric",
            "leather"
          ]
        },
        "accent": {
          "label": "Manta",
          "default": "fabric/rust-wool",
          "allowed": [
            "fabric",
            "leather"
          ]
        },
        "frame": {
          "label": "Estrutura e cabeceira",
          "default": "wood/walnut",
          "allowed": [
            "wood",
            "fabric",
            "leather",
            "paint"
          ]
        }
      },
      "tags": [
        "quarto"
      ],